timestamp,locale,keyword,rank,position,status
2026-06-14T03:59:18.233713+00:00,en,tiktok video downloader no watermark,,,error: <urlopen error [SSL: CERTIFICATE_VERIFY_FAILED] certificate verify failed: unabl
2026-06-14T03:59:20.812334+00:00,en,free tiktok downloader,,,error: <urlopen error [SSL: CERTIFICATE_VERIFY_FAILED] certificate verify failed: unabl
2026-06-14T03:59:23.427120+00:00,en,download tiktok videos without watermark,,,error: <urlopen error [SSL: CERTIFICATE_VERIFY_FAILED] certificate verify failed: unabl
2026-06-14T03:59:25.933243+00:00,id,download tiktok tanpa watermark,,,error: <urlopen error [SSL: CERTIFICATE_VERIFY_FAILED] certificate verify failed: unabl
2026-06-14T03:59:28.461921+00:00,id,cara download video tiktok,,,error: <urlopen error [SSL: CERTIFICATE_VERIFY_FAILED] certificate verify failed: unabl
2026-06-14T03:59:31.046609+00:00,id,pengunduh tiktok gratis,,,error: <urlopen error [SSL: CERTIFICATE_VERIFY_FAILED] certificate verify failed: unabl
2026-06-14T03:59:33.516272+00:00,vi,tải video tiktok không logo,,,error: <urlopen error [SSL: CERTIFICATE_VERIFY_FAILED] certificate verify failed: unabl
2026-06-14T03:59:36.060880+00:00,vi,tải tiktok không watermark,,,error: <urlopen error [SSL: CERTIFICATE_VERIFY_FAILED] certificate verify failed: unabl
2026-06-14T03:59:38.529048+00:00,vi,cách tải video tiktok miễn phí,,,error: <urlopen error [SSL: CERTIFICATE_VERIFY_FAILED] certificate verify failed: unabl
2026-06-14T03:59:41.042967+00:00,th,ดาวน์โหลดวิดีโอ tiktok ไม่มีลายน้ำ,,,error: <urlopen error [SSL: CERTIFICATE_VERIFY_FAILED] certificate verify failed: unabl
2026-06-14T03:59:43.899923+00:00,th,ดาวน์โหลด tiktok ฟรี,,,error: <urlopen error [SSL: CERTIFICATE_VERIFY_FAILED] certificate verify failed: unabl
2026-06-14T03:59:46.511205+00:00,th,โปรแกรมโหลด tiktok,,,error: <urlopen error [SSL: CERTIFICATE_VERIFY_FAILED] certificate verify failed: unabl
